{
  "schema_version": "v0",
  "registry_version": "1.0.0",
  "public_skill_id": "using-apex-forge",
  "enforcement_mode": "shadow",
  "previous_versions": {},
  "capabilities": [
    {
      "capability_id": "engineering-spec",
      "version": "1.0.0",
      "category": "core",
      "title": "Engineering Spec",
      "description": "Create a bounded implementation contract for ambiguous engineering work.",
      "protocol_ref": "capabilities/core/engineering-spec/PROTOCOL.md",
      "input_contract": "engineering-spec-request",
      "output_contract": "engineering-spec-evidence",
      "execution_class": "cognitive",
      "required_host_capabilities": ["structured_output"],
      "allowed_tools": ["read", "search"],
      "forbidden_actions": ["merge", "push", "approval_decide"],
      "default_budget": {
        "max_wall_minutes": 15,
        "max_agent_turns": 6,
        "max_tool_calls": 30
      },
      "availability": "portable",
      "certification": "bundled",
      "enabled": true,
      "provenance": {
        "source_name": "dev-spec-lite",
        "source_sha256": "cd24dfb81a0ce2a8691ee1c94e6b76fcfddad1185057d8a335685beebebe5d94",
        "license": "clean-room-no-copy",
        "absorption_policy": "REWRITE_ONLY"
      }
    },
    {
      "capability_id": "source-grounding",
      "version": "1.0.0",
      "category": "core",
      "title": "Source Grounding",
      "description": "Ground version-sensitive implementation in authoritative sources.",
      "protocol_ref": "capabilities/core/source-grounding/PROTOCOL.md",
      "input_contract": "source-grounding-request",
      "output_contract": "source-grounding-evidence",
      "execution_class": "cognitive",
      "required_host_capabilities": ["structured_output", "tool_use"],
      "allowed_tools": ["read", "search", "web_search"],
      "forbidden_actions": ["merge", "push", "approval_decide"],
      "default_budget": {
        "max_wall_minutes": 20,
        "max_agent_turns": 8,
        "max_tool_calls": 50
      },
      "availability": "host_dependent",
      "certification": "bundled",
      "enabled": true,
      "provenance": {
        "source_name": "dev-source-driven",
        "source_sha256": "12c77f69d5e27a965387a5b0124e5b1a8f6cf07eb384111d985ee0edb38b5bb5",
        "license": "clean-room-no-copy",
        "absorption_policy": "REWRITE_ONLY"
      }
    },
    {
      "capability_id": "architecture-design",
      "version": "1.0.0",
      "category": "core",
      "title": "Architecture Design",
      "description": "Define minimal technical architecture, ownership, failure, and rollback boundaries.",
      "protocol_ref": "capabilities/core/architecture-design/PROTOCOL.md",
      "input_contract": "architecture-design-request",
      "output_contract": "architecture-design-evidence",
      "execution_class": "cognitive",
      "required_host_capabilities": ["structured_output"],
      "allowed_tools": ["read", "search"],
      "forbidden_actions": ["merge", "push", "approval_decide"],
      "default_budget": {
        "max_wall_minutes": 30,
        "max_agent_turns": 12,
        "max_tool_calls": 70
      },
      "availability": "portable",
      "certification": "bundled",
      "enabled": true,
      "provenance": {
        "source_name": "Apex Forge V1 Design Consultation",
        "source_sha256": "059d8e07cd13093383bbcffd39b5594e51f03b6d9507c4b0c72022ddad12f1ac",
        "license": "MIT",
        "absorption_policy": "MIT"
      }
    },
    {
      "capability_id": "systematic-debugging",
      "version": "1.0.0",
      "category": "core",
      "title": "Systematic Debugging",
      "description": "Reproduce, localize, prove root cause, and guard a defect.",
      "protocol_ref": "capabilities/core/systematic-debugging/PROTOCOL.md",
      "input_contract": "debug-request",
      "output_contract": "root-cause-evidence",
      "execution_class": "cognitive",
      "required_host_capabilities": ["structured_output", "tool_use"],
      "allowed_tools": ["read", "search", "shell_test"],
      "forbidden_actions": ["merge", "push", "approval_decide"],
      "default_budget": {
        "max_wall_minutes": 30,
        "max_agent_turns": 12,
        "max_tool_calls": 80
      },
      "availability": "portable",
      "certification": "bundled",
      "enabled": true,
      "provenance": {
        "source_name": "dev-debug",
        "source_sha256": "01aa489a4c8e4699db24bea79a663f60d30d43ffcfc94b83f2f94a5d7e9342ad",
        "license": "clean-room-no-copy",
        "absorption_policy": "REWRITE_ONLY"
      }
    },
    {
      "capability_id": "tdd-negative-control",
      "version": "1.0.0",
      "category": "core",
      "title": "TDD And Negative Control",
      "description": "Prove a regression guard fails on the old behavior and passes on the candidate.",
      "protocol_ref": "capabilities/core/tdd-negative-control/PROTOCOL.md",
      "input_contract": "negative-control-request",
      "output_contract": "negative-control-evidence",
      "execution_class": "cognitive",
      "required_host_capabilities": ["structured_output", "tool_use"],
      "allowed_tools": ["read", "search", "shell_test"],
      "forbidden_actions": ["merge", "push", "approval_decide"],
      "default_budget": {
        "max_wall_minutes": 25,
        "max_agent_turns": 10,
        "max_tool_calls": 70
      },
      "availability": "portable",
      "certification": "bundled",
      "enabled": true,
      "provenance": {
        "source_name": "dev-tdd",
        "source_sha256": "d0df1ec352b95fcc543f014fb5f79042f71a9692d894fd7fde10ee4ec8307126",
        "license": "clean-room-no-copy",
        "absorption_policy": "REWRITE_ONLY"
      }
    },
    {
      "capability_id": "incremental-delivery",
      "version": "1.0.0",
      "category": "core",
      "title": "Incremental Delivery",
      "description": "Split multi-file implementation into coherent verified slices.",
      "protocol_ref": "capabilities/core/incremental-delivery/PROTOCOL.md",
      "input_contract": "incremental-delivery-request",
      "output_contract": "incremental-plan-evidence",
      "execution_class": "cognitive",
      "required_host_capabilities": ["structured_output"],
      "allowed_tools": ["read", "search"],
      "forbidden_actions": ["merge", "push", "approval_decide"],
      "default_budget": {
        "max_wall_minutes": 20,
        "max_agent_turns": 8,
        "max_tool_calls": 50
      },
      "availability": "portable",
      "certification": "bundled",
      "enabled": true,
      "provenance": {
        "source_name": "dev-incremental",
        "source_sha256": "aaf68453632487e65f70e818787584a56636611cc1cac3f81029c4fad9b73b75",
        "license": "clean-room-no-copy",
        "absorption_policy": "REWRITE_ONLY"
      }
    },
    {
      "capability_id": "code-review",
      "version": "1.0.0",
      "category": "core",
      "title": "Code Review",
      "description": "Review the current candidate for correctness, regressions, and merge readiness.",
      "protocol_ref": "capabilities/core/code-review/PROTOCOL.md",
      "input_contract": "code-review-request",
      "output_contract": "code-review-evidence",
      "execution_class": "cognitive",
      "required_host_capabilities": ["structured_output"],
      "allowed_tools": ["read", "search"],
      "forbidden_actions": ["merge", "push", "approval_decide"],
      "default_budget": {
        "max_wall_minutes": 25,
        "max_agent_turns": 10,
        "max_tool_calls": 60
      },
      "availability": "portable",
      "certification": "bundled",
      "enabled": true,
      "provenance": {
        "source_name": "dev-review",
        "source_sha256": "e47bda782958de17b8a79d5b879f3d70736821393c80b5d8313e7bbc44c5b028",
        "license": "clean-room-no-copy",
        "absorption_policy": "REWRITE_ONLY"
      }
    },
    {
      "capability_id": "security-audit",
      "version": "1.0.0",
      "category": "core",
      "title": "Security Audit",
      "description": "Inspect security-sensitive changes with evidence-backed findings.",
      "protocol_ref": "capabilities/core/security-audit/PROTOCOL.md",
      "input_contract": "security-audit-request",
      "output_contract": "security-audit-evidence",
      "execution_class": "cognitive",
      "required_host_capabilities": ["structured_output", "tool_use"],
      "allowed_tools": ["read", "search", "shell_audit"],
      "forbidden_actions": ["merge", "push", "approval_decide"],
      "default_budget": {
        "max_wall_minutes": 30,
        "max_agent_turns": 12,
        "max_tool_calls": 80
      },
      "availability": "portable",
      "certification": "bundled",
      "enabled": true,
      "provenance": {
        "source_name": "Apex Forge V1 Security Audit",
        "source_sha256": "442604e5d109ebb8f61b7062b774f98bd7fa81d80e0403a63e5e0260f1e90228",
        "license": "MIT",
        "absorption_policy": "MIT"
      }
    },
    {
      "capability_id": "high-risk-review",
      "version": "1.0.0",
      "category": "core",
      "title": "High Risk Review",
      "description": "Challenge expensive, irreversible, concurrent, or authorization-sensitive decisions.",
      "protocol_ref": "capabilities/core/high-risk-review/PROTOCOL.md",
      "input_contract": "high-risk-review-request",
      "output_contract": "high-risk-evidence",
      "execution_class": "cognitive",
      "required_host_capabilities": ["structured_output"],
      "allowed_tools": ["read", "search"],
      "forbidden_actions": ["merge", "push", "approval_decide"],
      "default_budget": {
        "max_wall_minutes": 25,
        "max_agent_turns": 10,
        "max_tool_calls": 60
      },
      "availability": "portable",
      "certification": "bundled",
      "enabled": true,
      "provenance": {
        "source_name": "dev-doubt",
        "source_sha256": "5711043f2bc8b74498a95c8b5d8a3dd697e2ca3d08543d33c4e3c56737e3f640",